{
  "$schema": "./schema.json",
  "id": "1623730",
  "name": "Palworld",
  "engine": "UnrealEngine5",
  "api": "DX12",
  "reverseZ": true,
  "rowMajorMatrices": true,
  "matrixPrecision": "Double64",
  "motionAimSensitivity": 1,
  "useRecommendedResolution": true,
  "srgbCorrection": true,
  "depthSubmission": true,
  "rawInputMode": true,
  "autoInjectOnLaunch": true
}
