{
  "$schema": "./schema.json",
  "id": "275850",
  "name": "No Man's Sky",
  "engine": "Generic",
  "api": "Vulkan",
  "reverseZ": false,
  "rowMajorMatrices": false,
  "matrixPrecision": "Float32",
  "motionAimSensitivity": 1.0,
  "useRecommendedResolution": true,
  "srgbCorrection": false,
  "depthSubmission": false,
  "rawInputMode": true,
  "autoInjectOnLaunch": true
}
