{
  "$schema": "./schema.json",
  "id": "custom_1788291330738",
  "name": "MECCHA CHAMELEON",
  "engine": "UnrealEngine5",
  "api": "DX12",
  "reverseZ": true,
  "rowMajorMatrices": true,
  "matrixPrecision": "Double64",
  "motionAimSensitivity": 1,
  "useRecommendedResolution": true,
  "srgbCorrection": false,
  "depthSubmission": true,
  "rawInputMode": true,
  "autoInjectOnLaunch": true
}
