{
  "$schema": "./schema.json",
  "id": "582010",
  "name": "Monster Hunter: World",
  "engine": "Generic",
  "api": "DX11",
  "reverseZ": false,
  "rowMajorMatrices": false,
  "matrixPrecision": "Float32",
  "motionAimSensitivity": 1.0,
  "useRecommendedResolution": true,
  "srgbCorrection": false,
  "depthSubmission": false,
  "rawInputMode": true,
  "autoInjectOnLaunch": true
}
